{
  "id": "data-table",
  "intent": "Sortable, selectable table of records with a caption stating the range, numeric columns and a per-row actions menu — compose the row menu from the row-actions pattern",
  "match": ["data table", "transactions table", "sortable table", "records table", "list of transactions"],
  "compose": {
    "component": "Table",
    "props": { "selectable": true, "sortable": true },
    "slots": {
      "body": [
        { "component": "TableCaption", "props": { "detail": "{content:range}" }, "content": "caption" },
        {
          "component": "TableHead",
          "slots": {
            "body": [
              {
                "component": "TableRow",
                "slots": {
                  "body": [
                    { "component": "TableHeaderCell", "props": { "sortKey": "date" }, "content": "date-label" },
                    { "component": "TableHeaderCell", "props": { "sortKey": "payee" }, "content": "payee-label" },
                    { "component": "TableHeaderCell", "props": { "sortKey": "amount", "numeric": true }, "content": "amount-label" },
                    { "component": "TableHeaderCell", "content": "actions-label" }
                  ]
                }
              }
            ]
          }
        },
        {
          "component": "TableBody",
          "slots": {
            "body": [
              {
                "component": "TableRow",
                "props": { "rowId": "row-id" },
                "slots": {
                  "body": [
                    { "component": "TableCell", "content": "date-cell" },
                    { "component": "TableCell", "content": "payee-cell" },
                    { "component": "TableCell", "props": { "numeric": true }, "content": "amount-cell" },
                    { "component": "TableCell", "content": "actions-cell" }
                  ]
                }
              }
            ]
          }
        }
      ]
    }
  },
  "parameters": [],
  "content": {
    "caption": "[what the table lists — its visible name]",
    "range": "[the rows shown, e.g. Rows 1–50 of 1,204; focus moves here after a page change]",
    "date-label": "Date",
    "payee-label": "Payee",
    "amount-label": "Amount",
    "actions-label": "[a visible \"Actions\" header — the column needs an accessible name, so never an empty th]",
    "date-cell": "[one row per record]",
    "payee-cell": "[the record's payee]",
    "amount-cell": "[numeric columns align right and use tabular figures]",
    "actions-cell": "[the row-actions menu — compose it from the row-actions pattern]"
  },
  "gaps": []
}
