{
  "id": "filter-toolbar",
  "intent": "Toolbar of filter controls that apply as they change: search, category select, active-filter tags — controls are named by aria-label/placeholder, not a visible label, so no Field (contrast table-pagination). For filters with visible labels, submitted together with a Find button, use filter-form",
  "match": [
    "filter toolbar",
    "filter bar",
    "search and filter",
    "faceted filters"
  ],
  "compose": {
    "component": "Toolbar",
    "slots": {
      "body": [
        {
          "component": "Input",
          "props": {
            "type": "search",
            "aria-label": "{content:search-label}",
            "placeholder": "{content:search-placeholder}"
          }
        },
        {
          "component": "Select",
          "props": {
            "aria-label": "{content:select-label}"
          }
        },
        {
          "component": "Tag",
          "content": "example-filter"
        }
      ]
    }
  },
  "parameters": [],
  "content": {
    "search-label": "Search transactions",
    "search-placeholder": "Search transactions",
    "select-label": "Category",
    "example-filter": "[active filter]"
  },
  "gaps": []
}
